156633,Walker Creek Campsite,Fiordland National Park,Fiordland,This is a small campsite beside the Eglinton River.,Standard,0,5,No,,"Fire pit/place for campfires (except in fire bans), Non-powered/tent sites, Water from stream, Toilets - non-flush, Toilets, Water supply",,No dogs. <a href=""https://www.doc.govt.nz/parks-and-recreation/know-before-you-go/pets-on-conservati,Rivers and lakes,"Campervan, Car",Refer to DOC website for current alerts,https://www.doc.govt.nz/thumbs/large/link/089738e0cd9c4b50b9f5249095b97be8.aspx,https://www.doc.govt.nz/link/03ef3fdd743c4311b4e23a596b45e176.aspx,Located in Fiordland National Park,1203952,4993449,100065491,6/25/2024 8:31:10 AM,69d67197-6a5c-419e-9ed1-b0e32c51797c,1203952,4993449
156634,Henry Creek Campsite,Fiordland National Park,Fiordland,Camp beside the picturesque Lake Te Anau on the road to Milford Sound.,Standard,0,40,No,,"Non-powered/tent sites, Water from stream, Wheelchair accessible with assistance, Toilets - non-flush, Toilets, Water supply",,No dogs. <a href=""https://www.doc.govt.nz/parks-and-recreation/know-before-you-go/pets-on-conservati,"Forest, Rivers and lakes","Campervan, Car, Caravan",Refer to DOC website for current alerts,https://www.doc.govt.nz/thumbs/large/link/ab2a4ffd52d14585b16b21241edfeace.aspx,https://www.doc.govt.nz/link/d87709f11ea7429084acc481422878e1.aspx,Located in Fiordland National Park,1192749,4978212,100042532,6/25/2024 8:31:10 AM,8121b69f-f5e0-4b36-9326-a02d763ff131,1192749,4978212
156635,Upper Eglinton Campsite,Fiordland National Park,Fiordland,"There are walking and tramping tracks near this campsite, including the Earl Mountain Tracks and you can fly fish in the river. There are magnificent valley views.",Standard,0,3,No,,"Fire pit/place for campfires (except in fire bans), Non-powered/tent sites, Water from stream, Toilets - non-flush, Toilets, Water supply",Fishing,No dogs. <a href=""https://www.doc.govt.nz/parks-and-recreation/know-before-you-go/pets-on-conservati,Rivers and lakes,"Campervan, Car",Refer to DOC website for current alerts,https://www.doc.govt.nz/thumbs/large/link/c688b137ecbe41abbb15def5e49ab0ed.jpg,https://www.doc.govt.nz/link/fa708d6242b9421399e2e078c957695a.aspx,Located in Fiordland National Park,1207940,5013084,100065490,6/25/2024 8:31:11 AM,44979ce7-a010-49c3-af4c-8be4966e137b,1207940,5013084
156636,Kiosk Creek Campsite,Fiordland National Park,Fiordland,There are spectacular views of glacial moraine deposits at this Fiordland campsite.,Standard,0,10,No,,"Fire pit/place for campfires (except in fire bans), Non-powered/tent sites, Toilets - non-flush, Toilets",,No dogs. <a href=""https://www.doc.govt.nz/parks-and-recreation/know-before-you-go/pets-on-conservati,,"Campervan, Car, Caravan",Refer to DOC website for current alerts,https://www.doc.govt.nz/thumbs/large/link/abb47a31f10d4eaea63ca1547351fb29.aspx,https://www.doc.govt.nz/link/48d5461385ce4e75a35bd2e1254dfc6f.aspx,Located in Fiordland National Park,1207153,5009087,100065488,6/25/2024 8:31:12 AM,e8a2cd97-544d-4daa-ae36-b56f5abc483b,1207153,5009087
156637,Totara Campsite,Fiordland National Park,Fiordland,This campsite is suitable for larger vehicles with sites sheltered by lush beech forest,Standard,0,20,No,,"Fire pit/place for campfires (except in fire bans), Non-powered/tent sites, Water from stream, Toilets - non-flush, Toilets, Water supply",,No dogs. <a href=""https://www.doc.govt.nz/parks-and-recreation/know-before-you-go/pets-on-conservati,Forest,"Campervan, Car, Caravan",Refer to DOC website for current alerts,https://www.doc.govt.nz/thumbs/large/link/8c1d85a7cf8448dbad957e62f166c423.jpg,https://www.doc.govt.nz/link/5967397fe0094551826e8cd65e45dbf8.aspx,Located in Fiordland National Park,1205251,4996355,100065489,6/25/2024 8:31:12 AM,5de11984-0853-4841-892e-87015928c8de,1205251,4996355
156638,Kapowairua (Spirits Bay) Campsite,Cape Reinga/Te Rerenga Wairua,Northland,"Camp with lush forests and sandy beaches in close range. Kapowairua is a place to relax, enjoy and explore the great outdoors.",Standard,0,45,Yes,,"Non-powered/tent sites, Shower - cold, Toilets - flush, Water from tap - not treated, boil before use, Toilets, Water supply","Bird and wildlife watching, Diving and snorkelling, Fishing, Swimming, Walking and tramping",No dogs. <a href=""https://www.doc.govt.nz/parks-and-recreation/know-before-you-go/pets-on-conservati,Coastal,"Campervan, Car, Foot",Refer to DOC website for current alerts,https://www.doc.govt.nz/thumbs/large/link/a4f92e5a298044e78dcc6a03b60ab15c.aspx,https://www.doc.govt.nz/link/e933f73e6bf447348c39246d2fdd72ac.aspx,Located in Cape Reinga/Te Rerenga Wairua,1587447,6190362,100065347,6/25/2024 8:31:12 AM,037ba69d-6169-4bba-9218-daf8ba8551ef,1587447,6190362
156639,Tapotupotu Campsite,Cape Reinga/Te Rerenga Wairua,Northland,Camp near a lagoon suitable for swimming and kayaking. Visit Cape Reinga/Te Rerenga Wairua only 5 minutes drive away or 3 hours via the walking track.,Standard,0,45,Yes,,"Non-powered/tent sites, Shower - cold, Water from tap - not treated, boil before use, Wheelchair accessible with assistance, Toilets - non-flush, Toilets, Water supply","Bird and wildlife watching, Diving and snorkelling, Fishing, Swimming, Walking and tramping",No dogs. <a href=""https://www.doc.govt.nz/parks-and-recreation/know-before-you-go/pets-on-conservati,Coastal,"Campervan, Car, Foot",Refer to DOC website for current alerts,https://www.doc.govt.nz/thumbs/large/link/12c0461883844b16bf89ba4385138fda.jpg,https://www.doc.govt.nz/link/4170df19f7ec4904bd7333f8da2f8fa1.aspx,Located in Cape Reinga/Te Rerenga Wairua,1573950,6189275,100065348,6/25/2024 8:31:13 AM,0b7b747a-cd13-442e-9eb8-d0258cf88f2f,1573950,6189275
156640,Otaio Gorge Campsite,Hunters Hills area,Canterbury,Camp at a scenic reserve beside forest; swim in the Otaio River.,Standard,0,15,Yes,,"Fire pit/place for campfires (except in fire bans), Non-powered/tent sites, Toilets - flush, Water from tap - not treated, boil before use, Toilets, Water supply",Swimming,No dogs. <a href=""https://www.doc.govt.nz/parks-and-recreation/know-before-you-go/pets-on-conservati,"Forest, Rivers and lakes","Campervan, Car, Caravan",Refer to DOC website for current alerts,https://www.doc.govt.nz/thumbs/large/link/2cb9a6b15b9d4e1a84b45000e32b7f67.jpg,https://www.doc.govt.nz/link/cc0b2980155f442ba317a9162f12e8fe.aspx,Located in Hunters Hills area,1435397,5067886,100031568,6/25/2024 8:31:13 AM,47efdcd6-ae2f-40e5-87b7-52ae37e9acea,1435397,5067886
156641,Mt Nimrod Campsite,Hunters Hills area,Canterbury,A quiet campsite on the eastern flank of the Hunter Hills. There is a 3.5 km forest walk to a podocarp forest remnant.,Standard,0,10,No,,"Fire pit/place for campfires (except in fire bans), Non-powered/tent sites, Water from tap - not treated, boil before use, Toilets - non-flush, Toilets, Water supply",Walking and tramping,No dogs. <a href=""https://www.doc.govt.nz/parks-and-recreation/know-before-you-go/pets-on-conservati,Forest,"Campervan, Car, Caravan",Refer to DOC website for current alerts,https://www.doc.govt.nz/thumbs/large/link/ec6c84ef490048f1802ecfdb29c11a2b.jpg,https://www.doc.govt.nz/link/b8a5afc47c3c4aa1914401c4196ff6ef.aspx,Located in Hunters Hills area,1430581,5077608,100065797,6/25/2024 8:31:14 AM,2c96c706-22e1-417e-984b-e554b09cbfa6,1430581,5077608
156642,Tōtaranui Campground,Abel Tasman National Park,Nelson/Tasman,"Camp next to the clear waters and golden sands of Tōtaranui beach at the northern end of the Abel Tasman National Park. It's a great place to relax on the beach, swim, kayak, fish or explore native bush on one of the nearby tracks.",Standard,0,269,Yes,,"Boat launching, Fire pit/place for campfires (except in fire bans), Dump station, Non-powered/tent sites, Shower - cold, Wheelchair accessible with assistance, Water from tap - treated, suitable for drinking, Toilets - non-flush, Toilets","Boating, Fishing, Kayaking and canoeing, Mountain biking, Swimming, Walking and tramping",No dogs. <a href=""https://www.doc.govt.nz/parks-and-recreation/know-before-you-go/pets-on-conservati,Coastal,"Boat, Campervan, Car, Caravan",Refer to DOC website for current alerts,https://www.doc.govt.nz/thumbs/large/link/d08e75fe8f1f40819ff8c0b9b27e45c9.jpg,https://www.doc.govt.nz/link/46ec985c84aa4df993cec51b96d8f6e3.aspx,Located in Abel Tasman National Park,1600414,5481379,100043766,6/25/2024 8:31:14 AM,5b7fa471-3159-466c-843f-6c2787de67c9,1600414,5481379
156643,Lake Tutira Campsite,Tutira area,Hawke’s Bay,"Camp at the southern end of the freshwater lake, and walk to Table Mountain Trig for views of inland Kaweka, Maungaharuru Range and coastal Hawke’s Bay. Enjoy fishing, swimming, kayaking and sailing on the lake.",Basic,0,0,No,,"Non-powered/tent sites, Water from tap - not treated, boil before use, Toilets - non-flush, Toilets, Water supply","Boating, Fishing, Kayaking and canoeing, Swimming",No dogs. <a href=""https://www.doc.govt.nz/parks-and-recreation/know-before-you-go/pets-on-conservati,Rivers and lakes,"Campervan, Car, Caravan",Refer to DOC website for current alerts,https://www.doc.govt.nz/thumbs/large/link/528ab5bdaab540c78c0d9904b20fc41e.jpg,https://www.doc.govt.nz/link/3196833f44ff46939ad885598123921e.aspx,Located in Tutira area,1936037,5650062,100043678,6/25/2024 8:31:14 AM,0b9e0143-d219-42ef-87ab-f670ba34222e,1936036.8361,5650061.735
156644,Twelve Mile Delta Campsite,Queenstown area,Otago,"Camp on a river delta at the outlet of Twelve-Mile Creek near the shores of Lake Wakatipu. Go boating, swimming and fishing or enjoy the walking and mountain biking tracks. Regenerating forest surrounds the campsite. ",Standard,0,100,No,,"Boat launching, Non-powered/tent sites, Water from tap - not treated, boil before use, Wheelchair accessible with assistance, Toilets - non-flush, Toilets, Water supply","Fishing, Picnicking",Dogs on a leash only. <a href=""https://www.doc.govt.nz/parks-and-recreation/know-before-you-go/pets-,Rivers and lakes,"Boat, Campervan, Car, Caravan",Refer to DOC website for current alerts,https://www.doc.govt.nz/thumbs/large/link/f7a29dc8dc2842729e71deda66b27175.jpg,https://www.doc.govt.nz/link/171fc7854c6a4620842508d18d4aa2de.aspx,Located in Queenstown area,1249410,4999902,100031419,6/25/2024 8:31:15 AM,c6946fb8-f26b-4c61-9b04-733c6ad8f51b,1249410,4999902
156645,Lake Middleton Campsite,Twizel area,Canterbury,Use this campsite as a base to walk or mountain bike in the Lake Ōhau area or in Ruataniwha Conservation Park.,Standard,0,0,No,,"Boat launching, Dump station, Non-powered/tent sites, Toilets - flush, Water from tap - not treated, boil before use, Toilets, Water supply","Mountain biking, Walking and tramping",Dogs on a leash only. <a href=""https://www.doc.govt.nz/parks-and-recreation/know-before-you-go/pets-,Rivers and lakes,"Campervan, Car",Refer to DOC website for current alerts,https://www.doc.govt.nz/thumbs/large/link/148041eba7324327a8926fd7ea295d3a.jpg,https://www.doc.govt.nz/link/b9fbfc5a98724008b2b85928467800c6.aspx,Located in Twizel area,1348583,5092872,100102965,6/25/2024 8:31:15 AM,5ee9d388-d545-4892-8317-7ac76cc03df2,1348583,5092872
156646,Sunset Bay Campsite,Urupukapuka Island Recreation Reserve,Northland,"This is a private and secluded campsite with stunning coastal surrounds. Relax on the beach, swim, kayak, fish or explore the nearby walking tracks.",Standard,0,2,Yes,,"Non-powered/tent sites, Water from tap - not treated, boil before use, Toilets - non-flush, Toilets, Water supply","Bird and wildlife watching, Diving and snorkelling, Walking and tramping",No dogs. <a href=""https://www.doc.govt.nz/parks-and-recreation/know-before-you-go/pets-on-conservati,Coastal,Boat,Refer to DOC website for current alerts,https://www.doc.govt.nz/thumbs/large/link/de9f0a2081c746f59b01bb649d73543e.aspx,https://www.doc.govt.nz/link/c7cb3ee7dda747c4a0d3e78b4fb63b2f.aspx,Located in Urupukapuka Island Recreation Reserve,1712067,6101175,100030189,6/25/2024 8:31:17 AM,ee587551-3cb3-4549-af54-d193ae0c7d0c,1712067,6101175
156647,Cable Bay Campsite,Urupukapuka Island Recreation Reserve,Northland,"Set in a sheltered bay with stunning coastal surrounds, Cable Bay is a great place for families to relax on the beach, swim, kayak, fish or explore the nearby walking tracks.",Standard,0,20,Yes,,"Non-powered/tent sites, Shower - cold, Water from tap - not treated, boil before use, Toilets - non-flush, Toilets, Water supply","Bird and wildlife watching, Diving and snorkelling, Walking and tramping",No dogs. <a href=""https://www.doc.govt.nz/parks-and-recreation/know-before-you-go/pets-on-conservati,Coastal,Boat,Refer to DOC website for current alerts,https://www.doc.govt.nz/thumbs/large/link/6f82a8ccb115408ab635bec820badefb.jpg,https://www.doc.govt.nz/link/1a86e1401a31456bbf0bb49960309166.aspx,Located in Urupukapuka Island Recreation Reserve,1712295,6101150,100040698,6/25/2024 8:31:18 AM,49014e11-361d-4c10-8523-97f014041d71,1712295,6101150
156648,Urupukapuka Bay Campsite,Urupukapuka Island Recreation Reserve,Northland,"Set in stunning coastal surrounds, this is a great place for families to relax on the beach, swim, kayak, fish or explore the nearby walking tracks. ",Standard,0,60,Yes,,"Non-powered/tent sites, Shower - cold, Water from tap - not treated, boil before use, Toilets - non-flush, Toilets, Water supply","Bird and wildlife watching, Diving and snorkelling",No dogs. <a href=""https://www.doc.govt.nz/parks-and-recreation/know-before-you-go/pets-on-conservati,Coastal,Boat,Refer to DOC website for current alerts,https://www.doc.govt.nz/thumbs/large/link/897652964c9f47fd8ab88bd6f5f9384a.jpg,https://www.doc.govt.nz/link/a7c8ed9ea1864de5822809110f786a30.aspx,Located in Urupukapuka Island Recreation Reserve,1712715,6102119,100065351,6/25/2024 8:31:19 AM,d5b9ef3c-8be3-4bc4-869b-98780f9839a0,1712715,6102119
156649,Dickey Flat Campsite,Kaimai Mamaku Conservation Park,Bay of Plenty,"This campsite is located beside the Waitawheta River, known for its trout and some great swimming holes downstream. There is a year-round liquor ban at the campsite. ",Standard,0,35,No,,"Non-powered/tent sites, Water from stream, Toilets - non-flush, Toilets, Water supply","Fishing, Swimming, Walking and tramping",Dogs on a leash only. <a href=""https://www.doc.govt.nz/parks-and-recreation/know-before-you-go/pets-,Rivers and lakes,Car,Refer to DOC website for current alerts,https://www.doc.govt.nz/thumbs/large/link/97a0afb5d1d645aa871552ae3f9426b8.jpg,https://www.doc.govt.nz/link/19cc973673014c7c839e16168f992ad1.aspx,Located in Kaimai Mamaku Conservation Park,1843053,5852978,100043934,6/25/2024 8:31:20 AM,f151b8d3-ddab-4215-9af1-d61aad9b28de,1843053,5852978
156650,Waikawau Bay Campsite,Northern Coromandel,Coromandel,"This spacious, family friendly  campsite is nestled beside a stunning white sand beach. The untouched Waikawau Bay is a fabulous place to relax on the beach, fish, swim, kayak or explore.",Standard,12,120,Yes,,"Non-powered/tent sites, Powered sites, Shower - cold, Water from tap - not treated, boil before use, Wheelchair accessible with assistance, Toilets - non-flush, Toilets, Water supply","Boating, Diving and snorkelling, Fishing, Swimming, Walking and tramping",No dogs. <a href=""https://www.doc.govt.nz/parks-and-recreation/know-before-you-go/pets-on-conservati,Coastal,"Campervan, Car, Caravan",Refer to DOC website for current alerts,https://www.doc.govt.nz/thumbs/large/link/feb1a983ff8b43dd805af1a152fc9d02.aspx,https://www.doc.govt.nz/link/35ca41563dbb4388987da305a1746033.aspx,Located in Northern Coromandel,1826915,5945852,100044313,6/25/2024 8:31:21 AM,f6dc955c-4301-43c0-a903-02ffb950a585,1826915,5945852
156651,Omahuru Campsite,Te Urewera,East Coast,"Camp, swim, fish, or relax beside the river in the Waimana valley. Take your binoculars for birdwatching.",Standard,0,40,No,,"Fire pit/place for campfires (except in fire bans), Non-powered/tent sites, Toilets - flush, Water from stream, Toilets, Water supply","Fishing, Swimming",No dogs. <a href=""https://www.doc.govt.nz/parks-and-recreation/know-before-you-go/pets-on-conservati,Forest,"Campervan, Car, Caravan",Refer to DOC website for current alerts,https://www.doc.govt.nz/thumbs/large/link/859f29869d73400d961e9e61252452c8.jpg,https://www.doc.govt.nz/link/e1b23f62d0314b288760dbd32237b56f.aspx,Located in Te Urewera,1960363,5751447,100043679,6/25/2024 8:31:21 AM,69a7b0e5-afd2-4762-9cd3-0e1ae5e3587b,1960363,5751447
156652,Waiohine Gorge Campsite,Tararua Forest Park,Wairarapa,"This secluded campsite is at the head of two spectacular gorges above the Waiohine River. A popular area for rafting, canoeing, swimming, and outdoor education.",Standard,0,50,No,,"Fire pit/place for campfires (except in fire bans), Non-powered/tent sites, Toilets - flush, Water from tap - not treated, boil before use, Toilets, Water supply","Kayaking and canoeing, Rafting, Swimming, Walking and tramping",Dogs on a leash only. <a href=""https://www.doc.govt.nz/parks-and-recreation/know-before-you-go/pets-,Rivers and lakes,"Campervan, Car, Caravan",Refer to DOC website for current alerts,https://www.doc.govt.nz/thumbs/large/link/f88473568afa49cc949af34acacc9fd3.aspx,https://www.doc.govt.nz/link/ff3ee04c8c6f40e3b19746065650b84d.aspx,Located in Tararua Forest Park,1801046,5458932,100031363,6/25/2024 8:31:22 AM,81ee82c2-473e-4cf5-8c1b-fb7f8c7b35ca,1801046,5458932
156653,Siberia Flat Campsite,Kahurangi National Park,Nelson/Tasman,"This is a standard campsite in the Motueka area. The campsite adjoins the Rolling River, popular for fly fishing, at the start of the Wangapeka Track. ",Standard,0,40,No,,"Fire pit/place for campfires (except in fire bans), Non-powered/tent sites, Water from stream, Toilets - non-flush, Toilets, Water supply",Fishing,No dogs. <a href=""https://www.doc.govt.nz/parks-and-recreation/know-before-you-go/pets-on-conservati,Rivers and lakes,Car,Refer to DOC website for current alerts,https://www.doc.govt.nz/thumbs/large/link/70f10719de0d4fe094cef18738938003.jpg,https://www.doc.govt.nz/link/f3e6a7b2cb3d4b7ab1828a2713d0d381.aspx,Located in Kahurangi National Park,1565231,5412084,100043947,6/25/2024 8:31:22 AM,8d98c3b1-1ad2-4e69-9154-fd1c485f4e29,1565231.2772,5412084.4855
156654,Courthouse Flat Campsite,Kahurangi National Park,Nelson/Tasman,"The scenic drive to the campsite is alongside a historic goldfield. Activities nearby the site include caving, picnicking, hunting and walking.",Standard,0,25,No,,"Fire pit/place for campfires (except in fire bans), Non-powered/tent sites, Water from stream, Toilets - non-flush, Toilets, Water supply","Caving, Hunting, Picnicking, Walking and tramping",No dogs. <a href=""https://www.doc.govt.nz/parks-and-recreation/know-before-you-go/pets-on-conservati,Forest,Car,Refer to DOC website for current alerts,https://www.doc.govt.nz/thumbs/large/link/8aad9118214e4fa387515be5121e921e.jpg,https://www.doc.govt.nz/link/895b8841ed1b44ed92f7c6ca57cabf9f.aspx,Located in Kahurangi National Park,1563895,5409253,100043775,6/25/2024 8:31:23 AM,76fd84f1-492a-4852-bed7-dc8881510845,1563895.1421,5409252.8361
156655,Wentworth Valley Campground,Coromandel Forest Park,Coromandel,"Once a large gold mining settlement with houses, shops and schools, this is now a remote but comfortable campsite. ",Standard,0,0,Yes,,Toilets,,Not Applicable,,,Refer to DOC website for current alerts,https://www.doc.govt.nz/thumbs/large/link/ac77db097cd64dccb60b432aa731c0b7.jpg,https://www.doc.govt.nz/link/eebb2451f4a44bea8f095dbd995f2274.aspx,Located in Coromandel Forest Park,1849966,5874024,100044315,6/25/2024 8:31:23 AM,4f6d3e69-1283-4422-97a9-fd67020d1c52,1849966,5874024
156656,Puriri Bay (Whangaruru North Head) Camps,Whangaruru North Head Scenic Reserve,Northland,"Overlooking the mouth of Whangaruru Harbour, this campsite has sheltered waters for swimming and boating activities, and a series of interconnected walks.",Standard,0,90,Yes,,"Boat launching, Non-powered/tent sites, Shelter for cooking, Shower - cold, Water from tap - not treated, boil before use, Wheelchair accessible, Toilets - non-flush, Toilets, Water supply","Boating, Fishing, Swimming, Walking and tramping",No dogs. <a href=""https://www.doc.govt.nz/parks-and-recreation/know-before-you-go/pets-on-conservati,Coastal,"Campervan, Car, Caravan",Refer to DOC website for current alerts,https://www.doc.govt.nz/thumbs/large/link/13833476907d47a584c5b5566bb86319.jpg,https://www.doc.govt.nz/link/1b013e3ad31647058dae6b315afe8a68.aspx,Located in Whangaruru North Head Scenic Reserve,1723562,6085659,100065349,6/25/2024 8:31:24 AM,4649b46a-9fbb-487e-a032-da2035572cc7,1723562,6085659
156657,Wooded Gully Campsite,Mount Thomas Forest Conservation Area,Canterbury,Camp beside a stream below tracks leading to Mt Thomas.,Standard,0,50,Yes,,"Non-powered/tent sites, Toilets - flush, Water from tap - not treated, boil before use, Wheelchair accessible with assistance, Toilets, Water supply",Walking and tramping,Dogs on a leash only. <a href=""https://www.doc.govt.nz/parks-and-recreation/know-before-you-go/pets-,Forest,"Campervan, Car, Caravan",Refer to DOC website for current alerts,https://www.doc.govt.nz/thumbs/large/link/4118735e7bde4f59a105b4fc6b502416.jpg,https://www.doc.govt.nz/link/3e18894098384f9dbc438c12e7c389ce.aspx,Located in Mount Thomas Forest Conservation Area,1546008,5217475,100064670,6/25/2024 8:31:24 AM,24f526d1-40a8-4e53-89ed-3b4f23ceb174,1546008,5217475
156658,Monowai Campsite,Fiordland National Park,Fiordland,"Enjoy this peaceful campsite beside Lake Monowai. Explore the tracks to Rodger Inlet and Green Lake huts, or go fishing or boating.",Basic,0,5,No,,"Boat launching, Fire pit/place for campfires (except in fire bans), Non-powered/tent sites, Water from tap - not treated, boil before use, Toilets - non-flush, Toilets, Water supply","Boating, Fishing",No dogs. <a href=""https://www.doc.govt.nz/parks-and-recreation/know-before-you-go/pets-on-conservati,Rivers and lakes,"Campervan, Car",Refer to DOC website for current alerts,https://www.doc.govt.nz/thumbs/large/link/97e1128d21a547ac8932bf0189c66c47.jpg,https://www.doc.govt.nz/link/793706babd574d15aea8cc495c3ee199.aspx,Located in Fiordland National Park,1174374,4912227,100043515,6/25/2024 8:31:25 AM,f1e77d82-eb76-41dc-9282-8093af143e00,1174374,4912227
156659,Kakapo Campsite,Kaimanawa Forest Park,Central North Island,"Camp in an area near tall forest, scrubland and tussock grasses.",Basic,0,4,No,,"Fire pit/place for campfires (except in fire bans), Non-powered/tent sites, Water from stream, Toilets - non-flush, Toilets, Water supply","Fishing, Hunting, Rafting, Walking and tramping",Dogs with a DOC permit only. Contact closest <a href=""#contacts"">DOC office</a> to get a permit. <a ,Forest,"Campervan, Car, Caravan",Refer to DOC website for current alerts,https://www.doc.govt.nz/thumbs/large/link/d8de92a8dad943c99dc7791f389b4345.jpg,https://www.doc.govt.nz/link/f23ae8dc45544aaebb73e594ab0c43a9.aspx,Located in Kaimanawa Forest Park,1875074,5683537,100066039,6/25/2024 8:31:25 AM,d0cc5bb0-23fb-4496-b7c5-06b3dfdbd09d,1875074,5683537
156660,Army Road Campsite,Kaimanawa Forest Park,Central North Island,"Camp in an area of diverse terrain; activities include hunting, walking/tramping, fishing and rafting.",Basic,0,6,No,,"Fire pit/place for campfires (except in fire bans), Non-powered/tent sites, Water from stream, Toilets - non-flush, Toilets, Water supply","Fishing, Hunting, Rafting, Walking and tramping",Dogs with a DOC permit only. Contact closest <a href=""#contacts"">DOC office</a> to get a permit. <a ,Forest,"Campervan, Car, Caravan",Refer to DOC website for current alerts,https://www.doc.govt.nz/thumbs/large/link/9eaa59cebb7e46fdbd7bb33ac3fa25a2.jpg,https://www.doc.govt.nz/link/7fd195f1f84a48838306b7eb165fe6dc.aspx,Located in Kaimanawa Forest Park,1873335,5682043,100031189,6/25/2024 8:31:26 AM,999d3a9c-9e93-475e-9363-c06318ce3c8d,1873335,5682043
156661,Hall Arm Campsite,Fiordland National Park,Fiordland,"This is a basic campsite in western Fiordland. It's in a beautiful forest sitting beside the water, in Hall Arm, Doubtful Sound.",Basic,0,6,No,,"Non-powered/tent sites, Water from tap - not treated, boil before use, Toilets - non-flush, Toilets, Water supply",,No dogs. <a href=""https://www.doc.govt.nz/parks-and-recreation/know-before-you-go/pets-on-conservati,"Forest, Rivers and lakes",Boat,Refer to DOC website for current alerts,https://www.doc.govt.nz/thumbs/large/link/056323448d1b495eb46905dbc60cf8d4.jpg,https://www.doc.govt.nz/link/49d79eccf49e48fda06e2e6e9c324fc5.aspx,Located in Fiordland National Park,1137277,4947582,100042740,6/25/2024 8:31:26 AM,e6fa1549-add7-4fbb-9b12-01ea38f368d6,1137277,4947582
156662,The Green Campsite,Great Barrier Island/Aotea,Auckland,A small campsite on the sheltered and scenic waters of Whangaparapara Harbour. This is a walk-in or boat-in campsite.,Standard,0,15,Yes,,"Non-powered/tent sites, Shelter for cooking, Water from tap - not treated, boil before use, Toilets - non-flush, Toilets, Water supply",,No dogs. <a href=""https://www.doc.govt.nz/parks-and-recreation/know-before-you-go/pets-on-conservati,Coastal,"Boat, Foot",Refer to DOC website for current alerts,https://www.doc.govt.nz/thumbs/large/link/75cb5eb037d24ff8b1d25b6c9b5ac387.jpg,https://www.doc.govt.nz/link/43a7ad2e4af7493d8db660b59bf75af3.aspx,Located in Great Barrier Island/Aotea,1815389,5987076,100044417,6/25/2024 8:31:27 AM,2acd2a3c-bfe4-4635-978e-11de8bd82a1e,1815389,5987076
