156573,Picnic Bay Campsite,Pelorus Sound/Te Hoiere and Kenepuru Sound area,Marlborough,"This is a scenic area with walking, sea kayaking, motor boating, kayaking, fishing and bird watching.",Standard,0,4,No,,"Non-powered/tent sites, Water from tap - not treated, boil before use, Toilets - non-flush, Toilets, Water supply","Boating, Fishing, Kayaking and canoeing, Walking and tramping",Dogs with a DOC permit only. Contact closest <a href=""#contacts"">DOC office</a> to get a permit. <a ,Coastal,"Boat, Campervan, Car, Caravan",Refer to DOC website for current alerts,https://www.doc.govt.nz/thumbs/large/link/e9232fce9f4a4003a8cc002a7d28b8cd.jpg,https://www.doc.govt.nz/link/12ccabc371ad4be5af2e156a08193d97.aspx,Located in Pelorus Sound/Te Hoiere and Kenepuru Sound area,1687749,5439037,100065808,6/25/2024 8:30:49 AM,4e8827a0-4a27-4d72-be66-b04e20a12a78,1687749,5439037
156574,Kenepuru Head Campsite,Pelorus Sound/Te Hoiere and Kenepuru Sound area,Marlborough,"Picturesque setting and a great base for a range of activities, including boating, fishing, walking and mountain biking on the nearby Queen Charlotte Track.",Standard,0,19,Yes,,"Non-powered/tent sites, Shelter for cooking, Shower - cold, Water from tap - not treated, boil before use, Wheelchair accessible with assistance, Toilets - non-flush, Toilets, Water supply","Boating, Fishing, Mountain biking, Walking and tramping",Dogs with a DOC permit only. Contact closest <a href=""#contacts"">DOC office</a> to get a permit. <a ,Coastal,Boat,Refer to DOC website for current alerts,https://www.doc.govt.nz/thumbs/large/link/449c9ffcf9674eff9fba31b8443732e9.aspx,https://www.doc.govt.nz/link/b507b541da634b2e928bef2371db8f3e.aspx,Located in Pelorus Sound/Te Hoiere and Kenepuru Sound area,1693786,5441344,100066100,6/25/2024 8:30:49 AM,d1c7465f-19dd-4daa-946f-4fd32a02df56,1693786,5441344
156575,Moetapu Bay Campsite,Pelorus Sound/Te Hoiere and Kenepuru Sound area,Marlborough,"A scenic spot for boating, fishing and swimming.",Standard,0,4,No,,"Non-powered/tent sites, Water from tap - not treated, boil before use, Toilets - non-flush, Toilets, Water supply","Boating, Fishing, Swimming",Dogs with a DOC permit only. Contact closest <a href=""#contacts"">DOC office</a> to get a permit. <a ,Coastal,"Boat, Foot",Refer to DOC website for current alerts,https://www.doc.govt.nz/thumbs/large/link/bc7fbda99add4de5bb43cbaab45dada6.jpg,https://www.doc.govt.nz/link/c6a53651b8c246d8ba284a2fd95c0311.aspx,Located in Pelorus Sound/Te Hoiere and Kenepuru Sound area,1671592,5431994,100044097,6/25/2024 8:30:49 AM,f746df4a-b117-4059-ae79-ed324351e45c,1671592,5431994
156576,Cowshed Bay Campsite,Pelorus Sound/Te Hoiere and Kenepuru Sound area,Marlborough,"Explore Kenepuru Sound by boat, walk or mountain bike the nearby Queen Charlotte Track or relax by the water surrounded by native bush.",Standard,0,20,Yes,,"Non-powered/tent sites, Shelter for cooking, Shower - cold, Toilets - flush, Water from tap - not treated, boil before use, Wheelchair accessible with assistance, Toilets, Water supply","Boating, Fishing, Mountain biking, Walking and tramping",No dogs. <a href=""https://www.doc.govt.nz/parks-and-recreation/know-before-you-go/pets-on-conservati,Coastal,"Boat, Foot",Refer to DOC website for current alerts,https://www.doc.govt.nz/thumbs/large/link/8ebaf4a7c4e44821ba209cf73a609ceb.jpg,https://www.doc.govt.nz/link/871fc80fc80643bda32c8c92d357f503.aspx,Located in Pelorus Sound/Te Hoiere and Kenepuru Sound area,1686520,5438297,100044093,6/25/2024 8:30:49 AM,d0b42db9-de28-417f-9123-a0b6d8ad8b00,1686520,5438297
156577,Kidds Bush Reserve Campsite,Hāwea Conservation Park,Otago,"Camp alongside Lake Hāwea in a large, grassy area with good shade from mountain beech trees. Walk around the lake, go fishing or swimming.",Standard,0,40,Yes,,"Boat launching, Non-powered/tent sites, Shelter for cooking, Water from tap - not treated, boil before use, Wheelchair accessible with assistance, Toilets - non-flush, Toilets, Water supply","Fishing, Swimming, Walking and tramping",No dogs. <a href=""https://www.doc.govt.nz/parks-and-recreation/know-before-you-go/pets-on-conservati,Rivers and lakes,"Boat, Campervan, Car, Caravan",Refer to DOC website for current alerts,https://www.doc.govt.nz/thumbs/large/link/d414d7a3bc324cf1958820e79759a010.jpg,https://www.doc.govt.nz/link/aee39660c6a54e6da2ec5bd95efb3937.aspx,Located in Hāwea Conservation Park,1302484,5072357,100065483,6/25/2024 8:30:50 AM,3f5d15fe-1a50-4a6b-b487-2534a52eac47,1302484,5072357
156578,Kōhaihai Campsite,Kahurangi National Park,West Coast,"Enjoy the beautiful nīkau forest at this campsite on the Kōhaihai River mouth. There are short, day or overnight walks from here, as well as kayaking and swimming opportunities in the river.",Standard,0,50,Yes,,"BBQ, Non-powered/tent sites, Toilets - flush, Water from tap - not treated, boil before use, Wheelchair accessible with assistance, Toilets, Water supply","Kayaking and canoeing, Swimming, Walking and tramping",Dogs on a leash only. <a href=""https://www.doc.govt.nz/parks-and-recreation/know-before-you-go/pets-,"Coastal, Rivers and lakes","Campervan, Car, Caravan",Refer to DOC website for current alerts,https://www.doc.govt.nz/thumbs/large/link/04a4db5409ef45ba9ddde380a9390d12.jpg,https://www.doc.govt.nz/link/feea42603a9c4ffe9572414d2e3f4d99.aspx,Located in Kahurangi National Park,1524647,5448696,100035410,6/25/2024 8:30:50 AM,e771c3e8-3414-4a02-a959-b165d7374dd5,1524647,5448696
156579,Kowhai Point Campsite,Kowhai Point Scenic Reserve,Marlborough,Camp next to the Wairau River with fishing and swimming nearby.,Basic,0,9,No,,"Non-powered/tent sites, Water from stream, Toilets - non-flush, Toilets, Water supply","Fishing, Swimming",No dogs. <a href=""https://www.doc.govt.nz/parks-and-recreation/know-before-you-go/pets-on-conservati,Rivers and lakes,"Campervan, Car, Caravan",Refer to DOC website for current alerts,https://www.doc.govt.nz/thumbs/large/link/476cdd2c38384dc2b1d0803d231639e4.jpg,https://www.doc.govt.nz/link/d459d79840e64975b21f09198e2049c2.aspx,Located in Kowhai Point Scenic Reserve,1609443,5382262,100066488,6/25/2024 8:30:50 AM,4fe29f99-0ba8-4b15-9e22-de1111c704fe,1609442.9904,5382262
156580,Marble Hill Campsite,Lewis Pass Scenic Reserve,West Coast,Explore this valley's alpine beauty and native birds in amazing red beech forests. Maruia Hot Springs are nearby.,Standard,0,20,Yes,,"BBQ, Non-powered/tent sites, Water from tap - not treated, boil before use, Wheelchair accessible with assistance, Toilets - non-flush, Toilets, Water supply","Bird and wildlife watching, Fishing, Scenic driving, Walking and tramping",No dogs. <a href=""https://www.doc.govt.nz/parks-and-recreation/know-before-you-go/pets-on-conservati,Forest,"Campervan, Car, Caravan",Refer to DOC website for current alerts,https://www.doc.govt.nz/thumbs/large/link/7af79064b8e341e6a5e7bcc3a9023541.aspx,https://www.doc.govt.nz/link/2edd9271a7144fb2bad5bc2747c28b84.aspx,Located in Lewis Pass Scenic Reserve,1536021,5311048,100043485,6/25/2024 8:30:50 AM,94267155-7bf0-40b4-8182-ca810eecc226,1536021,5311048
156581,Deer Valley Campsite,Lewis Pass Scenic Reserve,Canterbury,Camp in beech forest next to the Lewis River.,Standard,0,10,No,,"Non-powered/tent sites, Water from stream, Wheelchair accessible with assistance, Toilets - non-flush, Toilets, Water supply",,No dogs. <a href=""https://www.doc.govt.nz/parks-and-recreation/know-before-you-go/pets-on-conservati,Forest,"Campervan, Car, Caravan",Refer to DOC website for current alerts,https://www.doc.govt.nz/thumbs/large/link/a73b630b406e4074a335a83fdf53ec45.jpg,https://www.doc.govt.nz/link/ad0f09bc9ba84faf94ced688cd9aac62.aspx,Located in Lewis Pass Scenic Reserve,1550437,5305098,100044539,6/25/2024 8:30:51 AM,65c850be-c8aa-41fb-86d5-5f0c31fd2e6b,1550437,5305098
156582,Boyle Campsite,Lake Sumner Forest Park,Canterbury,Camp amongst the kānuka forest just off SH7 between Hanmer Springs and Lewis Pass. Boyle Campsite is on the Te Araroa Trail and at the end of the five-day tramp on the St James Walkway.,Standard,0,12,No,,"Non-powered/tent sites, Water from tap - not treated, boil before use, Wheelchair accessible with assistance, Toilets - non-flush, Toilets, Water supply",,Dogs on a leash only. <a href=""https://www.doc.govt.nz/parks-and-recreation/know-before-you-go/pets-,Forest,"Campervan, Car, Caravan",Refer to DOC website for current alerts,https://www.doc.govt.nz/thumbs/large/link/778a1d81a6fa43d994bbb625b3da2607.jpg,https://www.doc.govt.nz/link/6dcec8a03cce41b48e73eceec1bf47f0.aspx,Located in Lake Sumner Forest Park,1549601,5292677,100121059,6/25/2024 8:30:51 AM,32e34395-9dbd-421e-bc34-17876673fa73,1549601,5292677
156583,Lake Mahinapua Campsite,Mahinapua Scenic Reserve,West Coast,Camp beside Lake Mahinapua within forest surroundings. A popular overnight and day stop. Enjoy water sports in the lake.,Standard,0,100,Yes,,"Boat launching, Jetty, Non-powered/tent sites, Shelter for cooking, Shower - cold, Toilets - flush, Water from tap - not treated, boil before use, Wheelchair accessible with assistance, Toilets, Water supply","Boating, Swimming",No dogs. <a href=""https://www.doc.govt.nz/parks-and-recreation/know-before-you-go/pets-on-conservati,Rivers and lakes,"Campervan, Car, Caravan",Refer to DOC website for current alerts,https://www.doc.govt.nz/thumbs/large/link/ca530e5f21454f3ab73ab51c0ddba3fa.aspx,https://www.doc.govt.nz/link/bc426fe344d54ff9ad39301449dab043.aspx,Located in Mahinapua Scenic Reserve,1428348,5259848,100043034,6/25/2024 8:30:51 AM,ddeb227b-1545-4e28-a561-97b599552a02,1428348,5259848
156584,Lake Taylor Campsite,Lake Sumner Forest Park,Canterbury,Camp beside the lake and explore this highly scenic area by foot or mountain bike.,Standard,0,15,Yes,,"Non-powered/tent sites, Shelter for cooking, Water from tap - not treated, boil before use, Wheelchair accessible with assistance, Toilets - non-flush, Toilets, Water supply",,Dogs on a leash only. <a href=""https://www.doc.govt.nz/parks-and-recreation/know-before-you-go/pets-,Rivers and lakes,"Campervan, Car, Caravan",Refer to DOC website for current alerts,https://www.doc.govt.nz/thumbs/large/link/567a2c41b79a41d095bec9c507581677.jpg,https://www.doc.govt.nz/link/0873f893aea148a5a877f5b1943e2deb.aspx,Located in Lake Sumner Forest Park,1538960,5264062,100043178,6/25/2024 8:30:51 AM,70684dca-9879-4776-a38c-869d34e2bfcd,1538960,5264062
156585,Lake Paringa Campsite,"Haast, Paringa and Moeraki rivers area",West Coast,"Enjoy boating, fishing and swimming in the lake and walk the Haast to Paringa Cattle Track.",Standard,0,12,Yes,,"Boat launching, Non-powered/tent sites, Water from tap - not treated, boil before use, Wheelchair accessible, Toilets - non-flush, Toilets, Water supply","Boating, Fishing, Swimming, Walking and tramping",No dogs. <a href=""https://www.doc.govt.nz/parks-and-recreation/know-before-you-go/pets-on-conservati,Rivers and lakes,"Campervan, Car, Caravan",Refer to DOC website for current alerts,https://www.doc.govt.nz/thumbs/large/link/80060e2692a74adcab073116a1e4b242.jpg,https://www.doc.govt.nz/link/8e3e50fe721549049ce0ac83df9360ac.aspx,"Located in Haast, Paringa and Moeraki rivers area",1310929,5152778,100043486,6/25/2024 8:30:52 AM,c9de380c-def2-41f7-a396-8f156a85b08a,1310929,5152778
156586,Lake Rotoroa Campsite,Nelson Lakes National Park,Nelson/Tasman,An easily accessible camp in a picturesque setting - enjoy water activities or a stroll in the native bush.,Standard,0,10,No,,"Boat launching, Jetty, Non-powered/tent sites, Water from tap - not treated, boil before use, Toilets - non-flush, Toilets, Water supply","Boating, Four wheel driving, Kayaking and canoeing, Walking and tramping",No dogs. <a href=""https://www.doc.govt.nz/parks-and-recreation/know-before-you-go/pets-on-conservati,"Forest, Rivers and lakes","Campervan, Car, Caravan",Refer to DOC website for current alerts,https://www.doc.govt.nz/thumbs/large/link/caa659c8dba1486ebd182fb461b6e79e.jpg,https://www.doc.govt.nz/link/3e2030f135604da3840f551be35849b3.aspx,Located in Nelson Lakes National Park,1566590,5373011,100066492,6/25/2024 8:30:52 AM,33cb6710-654e-4579-acc5-544257a482ec,1566590,5373011
156587,Mokau Landing Campsite,Te Urewera,East Coast,"Large grassy site between native rainforest and Lake Waikaremoana, 1.5 km from Mōkau Falls.",Standard,0,40,No,,"Boat launching, Fire pit/place for campfires (except in fire bans), Non-powered/tent sites, Water from tap - not treated, boil before use, Wheelchair accessible with assistance, Toilets - non-flush, Toilets, Water supply",,No dogs. <a href=""https://www.doc.govt.nz/parks-and-recreation/know-before-you-go/pets-on-conservati,"Forest, Rivers and lakes","Campervan, Car, Caravan",Refer to DOC website for current alerts,https://www.doc.govt.nz/thumbs/large/link/21816e50188d44d399ba2c49c4e78bae.jpg,https://www.doc.govt.nz/link/b992aed862b74ac2939d7ed5adee72f8.aspx,Located in Te Urewera,1955532,5704909,100043675,6/25/2024 8:30:52 AM,7eb98fc0-06a1-4175-8184-575a7378ba88,1955532,5704909
156588,Lyell Campsite,Lyell area,West Coast,"The site of the historic gold-rush town of Lyell, this large, grassed campsite is easily accessible. Explore the gold workings at settlements of Gibbstown (2 hr return), Zalatown and 8 Mile, plus the Alpine Battery site.",Standard,0,18,Yes,,"BBQ, Non-powered/tent sites, Water from tap - not treated, boil before use, Wheelchair accessible with assistance, Toilets - non-flush, Toilets, Water supply",Walking and tramping,Dogs on a leash only. <a href=""https://www.doc.govt.nz/parks-and-recreation/know-before-you-go/pets-,,"Campervan, Car, Caravan",Refer to DOC website for current alerts,https://www.doc.govt.nz/thumbs/large/link/1a5fc4edde9b440491dff59b666e6f6d.jpg,https://www.doc.govt.nz/link/18af6f4c747049988b450066d4bc061e.aspx,Located in Lyell area,1520990,5372328,100043484,6/25/2024 8:30:53 AM,7300d424-fd70-4c41-b452-849a2fcf8024,1520990,5372328
156589,Maitai Bay Campsite,Karikari Peninsula,Northland,This Kaitaia area campsite is popular with families. Camp in a sheltered bay nestled amongst beautiful pohutukawa trees.,Standard,0,100,No,,"Non-powered/tent sites, Shower - cold, Toilets - flush, Water from tap - not treated, boil before use, Wheelchair accessible with assistance, Toilets, Water supply","Bird and wildlife watching, Diving and snorkelling",No dogs. <a href=""https://www.doc.govt.nz/parks-and-recreation/know-before-you-go/pets-on-conservati,Coastal,"Campervan, Car, Caravan",Refer to DOC website for current alerts,https://www.doc.govt.nz/thumbs/large/link/f80e873ef77649859504e1df6b434812.jpg,https://www.doc.govt.nz/link/f2b36c981bed49769187977b5db6e330.aspx,Located in Karikari Peninsula,1637315,6145779,100066494,6/25/2024 8:30:53 AM,913bbb6a-8948-4012-89c7-40ac7b3d426b,1637315,6145779
156590,Cameron Flat Campsite,Makarora area,Otago,"This is a standard campsite in the Wanaka/Makarora area. Camp near the Makarora River. Plenty of great activities are available nearby, such as hunting, tramping or fishing.",Standard,0,30,Yes,,"Non-powered/tent sites, Shelter for cooking, Water from tap - not treated, boil before use, Wheelchair accessible, Toilets - non-flush, Toilets, Water supply","Fishing, Hunting, Walking and tramping",No dogs. <a href=""https://www.doc.govt.nz/parks-and-recreation/know-before-you-go/pets-on-conservati,Rivers and lakes,"Campervan, Car, Caravan",Refer to DOC website for current alerts,https://www.doc.govt.nz/thumbs/large/link/d0d2259da238460e92b9ecd74a7a81b6.jpg,https://www.doc.govt.nz/link/0c9f620a83ed40a599d91557a7235432.aspx,Located in Makarora area,1303139,5103514,100064830,6/25/2024 8:30:53 AM,5f8bf3fa-c159-45e7-9b6e-ff45e734a3be,1303139,5103514
156591,Pleasant Flat Campsite,Mount Aspiring National Park,Otago,"This is a standard campsite in the Wanaka/Makarora area. Take in the magnificent views of Mt Hooker from the campsite. Fish in nearby Haast River, enjoy short walks or picnics.",Standard,0,22,Yes,,"Non-powered/tent sites, Shelter for cooking, Toilets - flush, Water from tap - not treated, boil before use, Wheelchair accessible, Toilets, Water supply",Fishing,No dogs. <a href=""https://www.doc.govt.nz/parks-and-recreation/know-before-you-go/pets-on-conservati,Rivers and lakes,"Campervan, Car, Caravan",Refer to DOC website for current alerts,https://www.doc.govt.nz/thumbs/large/link/88b87b36fb714b15a7964c3bfe6528e9.jpg,https://www.doc.govt.nz/link/6a4b26aec95442bb8704ffc06a1871a7.aspx,Located in Mount Aspiring National Park,1309901,5120448,100065484,6/25/2024 8:30:53 AM,d77ed8ef-1b9a-4e64-a01b-50865a69f7c7,1309901,5120448
156592,Mangahuia Campsite,Tongariro National Park,Central North Island,A peaceful campsite beside a stream on the edge of the Tongariro National Park. ,Standard,0,21,Yes,,"Non-powered/tent sites, Shelter for cooking, Water from tap - not treated, boil before use, Toilets - non-flush, Toilets, Water supply",Walking and tramping,No dogs. <a href=""https://www.doc.govt.nz/parks-and-recreation/know-before-you-go/pets-on-conservati,,"Campervan, Car, Caravan",Refer to DOC website for current alerts,https://www.doc.govt.nz/thumbs/large/link/b76a1c7e043f4011bb4edbb573ecd4ed.jpg,https://www.doc.govt.nz/link/2bd99c0658c34f78a0ff0cb38e8928e7.aspx,Located in Tongariro National Park,1813334,5660336,100044154,6/25/2024 8:30:54 AM,e8404486-1703-4bba-a2f0-e04ea7553e02,1813334,5660336
156593,Marfells Beach Campsite,Marfells Beach area,Marlborough,Camp within your own touch of paradise next to the sea. Enjoy the stunning wildlife and magnificent scenery. ,Standard,0,41,Yes,,"Boat launching, Non-powered/tent sites, Shower - cold, Toilets - flush, Water from tap - not treated, boil before use, Wheelchair accessible, Toilets, Water supply","Fishing, Walking and tramping",No dogs. <a href=""https://www.doc.govt.nz/parks-and-recreation/know-before-you-go/pets-on-conservati,Coastal,"Campervan, Car, Caravan",Refer to DOC website for current alerts,https://www.doc.govt.nz/thumbs/large/link/9fd2cae4e8664c788c48c2766cf96a50.aspx,https://www.doc.govt.nz/link/8a0e3ce89fec4297ac99778478d65a31.aspx,Located in Marfells Beach area,1700179,5380002,100066489,6/25/2024 8:30:54 AM,d08273ac-e7f4-4b84-be22-04e868b47cd5,1700179,5380002
156594,Kiriwhakapapa Campsite,Tararua Forest Park,Wairarapa,"This is a lovely family campsite beside a creek, with an old logging and exotic redwood forest trail area nearby.",Standard,0,15,No,,"Fire pit/place for campfires (except in fire bans), Non-powered/tent sites, Shelter for cooking, Toilets - flush, Water from stream, Toilets, Water supply",Walking and tramping,Dogs on a leash only. <a href=""https://www.doc.govt.nz/parks-and-recreation/know-before-you-go/pets-,"Forest, Rivers and lakes","Campervan, Car, Caravan",Refer to DOC website for current alerts,https://www.doc.govt.nz/thumbs/large/link/52d849ade3524613bf20456a819448d6.jpg,https://www.doc.govt.nz/link/10160bc0d7854c0496fb5c899e7e14bb.aspx,Located in Tararua Forest Park,1814763,5479438,100044517,6/25/2024 8:30:54 AM,43580abc-ac5f-4293-a9a7-043030a72307,1814763,5479438
156595,Matatā Campsite,Matatā area,Bay of Plenty,This is a family campsite in a coastal setting with excellent fishing and swimming next to the Matatā wildlife refuge. No dogs are allowed.,Standard,0,80,Yes,,"Non-powered/tent sites, Shower - hot, Water from tap - treated, suitable for drinking, Toilets - non-flush, Toilets","Bird and wildlife watching, Fishing, Swimming",No dogs. <a href=""https://www.doc.govt.nz/parks-and-recreation/know-before-you-go/pets-on-conservati,Coastal,"Campervan, Car, Caravan",Refer to DOC website for current alerts,https://www.doc.govt.nz/thumbs/large/link/25323c325b6145648e2d64be99b26069.aspx,https://www.doc.govt.nz/link/983b3b551a6b4ba6927d554fe97ff78f.aspx,Located in Matatā area,1930738,5800119,100085474,6/25/2024 8:30:54 AM,b85284de-5fc4-43ef-9246-ff13f2d7d212,1930738,5800119
156596,Matiu/somes Island Campsite,Matiu/Somes Island,Wellington/Kapiti,Camp in a sheep paddock on this historic island.,Standard,0,12,Yes,,"Cookers/electric stove, Non-powered/tent sites, Shelter for cooking, Wheelchair accessible with assistance, Water from tap - treated, suitable for drinking, Toilets - non-flush, Toilets",,No dogs. <a href=""https://www.doc.govt.nz/parks-and-recreation/know-before-you-go/pets-on-conservati,Coastal,Boat,Refer to DOC website for current alerts,https://www.doc.govt.nz/thumbs/large/link/383b19a3b3c043a59424f202bd85e10d.jpg,https://www.doc.govt.nz/link/fd8e1ab6329144b7982f9083cd83a8b4.aspx,Located in Matiu/Somes Island,1756303,5430941,100037922,6/25/2024 8:30:55 AM,2c1e7cab-82fc-497c-842e-835529da2f96,1756303,5430941
156597,Mavora Lakes Campsite,Mavora Lakes Conservation Park,Southland,"Mavora Lakes Campsite has two main (standard) camping areas: one alongside South Mavora Lake, and the other between South Mavora Lake and North Mavora Lake. ",Standard,0,60,Yes,,"BBQ, Boat launching, Fire pit/place for campfires (except in fire bans), Non-powered/tent sites, Water from tap - not treated, boil before use, Toilets - non-flush, Toilets, Water supply","Boating, Fishing, Mountain biking",Dogs on a leash only. <a href=""https://www.doc.govt.nz/parks-and-recreation/know-before-you-go/pets-,Rivers and lakes,"Campervan, Car, Caravan, Mountain bike",Refer to DOC website for current alerts,https://www.doc.govt.nz/thumbs/large/link/e18537aa01f6454bb338f9a599e24138.jpg,https://www.doc.govt.nz/link/07540cfcf9404be8bb256d49ef81d0d9.aspx,Located in Mavora Lakes Conservation Park,1221497,4975941,100044152,6/25/2024 8:30:55 AM,d6ca2534-c9af-46bd-9503-d5d7927f422c,1221497,4975941
156598,Cascade Creek Campsite,Fiordland National Park,Fiordland,This is a standard campsite in northern Fiordland that is good for larger vehicles.,Standard,0,120,Yes,,"Fire pit/place for campfires (except in fire bans), Non-powered/tent sites, Shelter for cooking, Water from stream, Wheelchair accessible, Toilets - non-flush, Toilets, Water supply",Fishing,No dogs. <a href=""https://www.doc.govt.nz/parks-and-recreation/know-before-you-go/pets-on-conservati,Rivers and lakes,"Campervan, Car, Caravan",Refer to DOC website for current alerts,https://www.doc.govt.nz/thumbs/large/link/6f2b7a0e9c664188a5db9d26496ac023.aspx,https://www.doc.govt.nz/link/1b40c89315e5410e930a629c174a093e.aspx,Located in Fiordland National Park,1211142,5016992,100039602,6/25/2024 8:30:56 AM,4ebb2933-ab5f-48eb-874b-3da7da3ce205,1211142,5016992
156599,Waikahoa Bay Campsite,Mimiwhangata Coastal Park,Northland,Camp beside a sandy beach among pōhutukawa trees. A great spot for water activities.,Standard,0,35,Yes,,"Non-powered/tent sites, Shower - cold, Water from tap - not treated, boil before use, Toilets - non-flush, Toilets, Water supply","Bird and wildlife watching, Diving and snorkelling, Kayaking and canoeing, Swimming, Walking and tramping",No dogs. <a href=""https://www.doc.govt.nz/parks-and-recreation/know-before-you-go/pets-on-conservati,Coastal,Foot,Refer to DOC website for current alerts,https://www.doc.govt.nz/thumbs/large/link/5ca45f7cc52f40f0bea81df174f7f487.jpg,https://www.doc.govt.nz/link/a83378d7a1f8469a8e480fdb42a88099.aspx,Located in Mimiwhangata Coastal Park,1728210,6077006,100065352,6/25/2024 8:30:56 AM,83bdf316-0c33-485d-8b4b-3d1347cb37a9,1728210.0028,6077005.6062
156600,Trotters Gorge Campsite,Moeraki area,Otago,This is a quiet family standard campsite on the Otago coast in a bush setting. It connects with two riverside tracks.,Standard,0,10,Yes,,"Non-powered/tent sites, Water from stream, Toilets - non-flush, Toilets, Water supply",Walking and tramping,Dogs on a leash only. <a href=""https://www.doc.govt.nz/parks-and-recreation/know-before-you-go/pets-,Forest,"Campervan, Car, Caravan",Refer to DOC website for current alerts,https://www.doc.govt.nz/thumbs/large/link/4a139913ccc24638822fb2846bb9f760.jpg,https://www.doc.govt.nz/link/3d178eddc761482bb514a165860862d3.aspx,Located in Moeraki area,1426406,4969749,100065537,6/25/2024 8:30:57 AM,be9725bc-f409-4e64-8439-3b2234be29d9,1426406,4969749
156601,Acheron Accommodation House Campsite,Molesworth Recreation Reserve,Marlborough,"Camp by this historic cobb building from 1863, once used as an overnight carriage stop.",Standard,0,20,No,,"Non-powered/tent sites, Water from tap - not treated, boil before use, Toilets - non-flush, Toilets, Water supply",,No dogs. <a href=""https://www.doc.govt.nz/parks-and-recreation/know-before-you-go/pets-on-conservati,,"Campervan, Car, Mountain bike",Refer to DOC website for current alerts,https://www.doc.govt.nz/thumbs/large/link/3f964535f2574297a72fa76ac4107aae.jpg,https://www.doc.govt.nz/link/de545f9ea0be468e9629f6dc740720f6.aspx,Located in Molesworth Recreation Reserve,1596410,5306311,100065342,6/25/2024 8:30:57 AM,fc80001d-6751-4d44-ade6-522d2a0b9b72,1596410,5306311
156602,Molesworth Cob Cottage Campsite,Molesworth Recreation Reserve,Marlborough,Camp near the original cob cottage built in 1885 close to the Molesworth Recreation Reserve boundary.,Standard,0,20,No,,"Non-powered/tent sites, Water from tap - not treated, boil before use, Toilets - non-flush, Toilets, Water supply","Fishing, Mountain biking, Scenic driving",No dogs. <a href=""https://www.doc.govt.nz/parks-and-recreation/know-before-you-go/pets-on-conservati,,"Campervan, Car, Mountain bike",Refer to DOC website for current alerts,https://www.doc.govt.nz/thumbs/large/link/e818eec4caf849c59135d6288294159e.jpg,https://www.doc.govt.nz/link/3bd9a0f5beb544979ccf0399a57a1224.aspx,Located in Molesworth Recreation Reserve,1622348,5340738,100066490,6/25/2024 8:30:57 AM,550c70c2-6d7a-48e5-af75-950678ea946d,1622348,5340738
